	abstract	arxiv_id	author_text	created	doi	num_authors	num_categories	title	updated	categories_str	url
74349	 In current study, a mechanism to extract traffic related information such as congestion and incidents from textual data from the internet is proposed. The current source of data is Twitter. As the data being considered is extremely large in size automated models are developed to stream, download, and mine the data in real-time. Furthermore, if any tweet has traffic related information then the models should be able to infer and extract this data. Currently, the data is collected only for United States and a total of 120,000 geo-tagged traffic related tweets are extracted, while six million geo-tagged non-traffic related tweets are retrieved and classification models are trained. Furthermore, this data is used for various kinds of spatial and temporal analysis. A mechanism to calculate level of traffic congestion, safety, and traffic perception for cities in U.S. is proposed. Traffic congestion and safety rankings for the various urban areas are obtained and then they are statistically validated with existing widely adopted rankings. Traffic perception depicts the attitude and perception of people towards the traffic. It is also seen that traffic related data when visualized spatially and temporally provides the same pattern as the actual traffic flows for various urban areas. When visualized at the city level, it is clearly visible that the flow of tweets is similar to flow of vehicles and that the traffic related tweets are representative of traffic within the cities. With all the findings in current study, it is shown that significant amount of traffic related information can be extracted from Twitter and other sources on internet. Furthermore, Twitter and these data sources are freely available and are not bound by spatial and temporal limitations. That is, wherever there is a user there is a potential for data. 	1801.05088	Chandra Khatri	2018-01-15		1	5	Real-time Road Traffic Information Detection Through Social Media		cs.CL, cs.AI, cs.CY, cs.IR, cs.SI	https://arxiv.org/pdf/1801.05088.pdf
146554	 Adversarial samples are strategically modified samples, which are crafted with the purpose of fooling a classifier at hand. An attacker introduces specially crafted adversarial samples to a deployed classifier, which are being mis-classified by the classifier. However, the samples are perceived to be drawn from entirely different classes and thus it becomes hard to detect the adversarial samples. Most of the prior works have been focused on synthesizing adversarial samples in the image domain. In this paper, we propose a new method of crafting adversarial text samples by modification of the original samples. Modifications of the original text samples are done by deleting or replacing the important or salient words in the text or by introducing new words in the text sample. Our algorithm works best for the datasets which have sub-categories within each of the classes of examples. While crafting adversarial samples, one of the key constraint is to generate meaningful sentences which can at pass off as legitimate from language (English) viewpoint. Experimental results on IMDB movie review dataset for sentiment analysis and Twitter dataset for gender detection show the efficiency of our proposed method. 	1707.02812	Suranjana Samanta, Sameep Mehta	2017-07-10		2	4	Towards Crafting Text Adversarial Samples		cs.LG, cs.AI, cs.CL, cs.CV	https://arxiv.org/pdf/1707.02812.pdf
222638	 Due to exponential growth of complex data, graph structure has become increasingly important to model various entities and their interactions, with many interesting applications including, bioinformatics, social network analysis, etc. Depending on the complexity of the data, the underlying graph model can be a simple directed/undirected and/or weighted/un-weighted graph to a complex graph (aka multi-attributed graph) where vertices and edges are labelled with multi-dimensional vectors. In this paper, we present a novel weighted distance measure based on weighted Euclidean norm which is defined as a function of both vertex and edge attributes, and it can be used for various graph analysis tasks including classification and cluster analysis. The proposed distance measure has flexibility to increase/decrease the weightage of edge labels while calculating the distance between vertex-pairs. We have also proposed a MAGDist algorithm, which reads multi-attributed graph stored in CSV files containing the list of vertex vectors and edge vectors, and calculates the distance between each vertex-pair using the proposed weighted distance measure. Finally, we have proposed a multi-attributed similarity graph generation algorithm, MAGSim, which reads the output of MAGDist algorithm and generates a similarity graph that can be analysed using classification and clustering algorithms. The significance and accuracy of the proposed distance measure and algorithms is evaluated on Iris and Twitter data sets, and it is found that the similarity graph generated by our proposed method yields better clustering results than the existing similarity graph generation methods. 	1801.07150	Muhammad Abulaish, Jahiruddin	2018-01-22		2	4	A Novel Weighted Distance Measure for Multi-Attributed Graph		cs.SI, cs.AI, cs.DS, cs.IR	https://arxiv.org/pdf/1801.07150.pdf
225951	 Social media provides a mechanism for people to engage with social causes across a range of issues. It also provides a strategic tool to those looking to advance a cause to exchange, promote or publicize their ideas. In such instances, AI can be either an asset if used appropriately or a barrier. One of the key issues for a workforce diversity campaign is to understand in real-time who is participating - specifically, whether the participants are individuals or organizations, and in case of individuals, whether they are male or female. In this paper, we present a study to demonstrate a case for AI for social good that develops a model to infer in real-time the different user types participating in a cause-driven hashtag campaign on Twitter, ILookLikeAnEngineer (ILLAE). A generic framework is devised to classify a Twitter user into three classes: organization, male and female in a real-time manner. The framework is tested against two datasets (ILLAE and a general dataset) and outperforms the baseline binary classifiers for categorizing organization/individual and male/female. The proposed model can be applied to future social cause-driven campaigns to get real-time insights on the macro-level social behavior of participants. 	1804.09304	Habib Karbasian, Hemant Purohit, Rajat Handa, Aqdas Malik, Aditya Johri	2018-04-24		5	2	Real-Time Inference of User Types to Assist with More Inclusive Social Media Activism Campaigns		cs.SI, cs.AI	https://arxiv.org/pdf/1804.09304.pdf
239793	 The problem of detecting bots, automated social media accounts governed by software but disguising as human users, has strong implications. For example, bots have been used to sway political elections by distorting online discourse, to manipulate the stock market, or to push anti-vaccine conspiracy theories that caused health epidemics. Most techniques proposed to date detect bots at the account level, by processing large amount of social media posts, and leveraging information from network structure, temporal dynamics, sentiment analysis, etc. In this paper, we propose a deep neural network based on contextual long short-term memory (LSTM) architecture that exploits both content and metadata to detect bots at the tweet level: contextual features are extracted from user metadata and fed as auxiliary input to LSTM deep nets processing the tweet text. Another contribution that we make is proposing a technique based on synthetic minority oversampling to generate a large labeled dataset, suitable for deep nets training, from a minimal amount of labeled data (roughly 3,000 examples of sophisticated Twitter bots). We demonstrate that, from just one single tweet, our architecture can achieve high classification accuracy (AUC > 96%) in separating bots from humans. We apply the same architecture to account-level bot detection, achieving nearly perfect classification accuracy (AUC > 99%). Our system outperforms previous state of the art while leveraging a small and interpretable set of features yet requiring minimal training data. 	1802.04289	Sneha Kudugunta, Emilio Ferrara	2018-02-12		2	2	Deep Neural Networks for Bot Detection	2018-02-18	cs.AI, cs.SI	https://arxiv.org/pdf/1802.04289.pdf
299491	 Variation in language is ubiquitous, particularly in newer forms of writing such as social media. Fortunately, variation is not random, it is often linked to social properties of the author. In this paper, we show how to exploit social networks to make sentiment analysis more robust to social language variation. The key idea is linguistic homophily: the tendency of socially linked individuals to use language in similar ways. We formalize this idea in a novel attention-based neural network architecture, in which attention is divided among several basis models, depending on the author's position in the social network. This has the effect of smoothing the classification function across the social network, and makes it possible to induce personalized classifiers even for authors for whom there is no labeled data or demographic metadata. This model significantly improves the accuracies of sentiment analysis on Twitter and on review data. 	1511.06052	Yi Yang, Jacob Eisenstein	2015-11-18		2	3	Overcoming Language Variation in Sentiment Analysis with Social Attention	2017-08-26	cs.CL, cs.AI, cs.SI	https://arxiv.org/pdf/1511.06052.pdf
339588	 The ever-growing datasets published on Linked Open Data mainly contain encyclopedic information. However, there is a lack of quality structured and semantically annotated datasets extracted from unstructured real-time sources. In this paper, we present principles for developing a knowledge graph of interlinked events using the case study of news headlines published on Twitter which is a real-time and eventful source of fresh information. We represent the essential pipeline containing the required tasks ranging from choosing background data model, event annotation (i.e., event recognition and classification), entity annotation and eventually interlinking events. The state-of-the-art is limited to domain-specific scenarios for recognizing and classifying events, whereas this paper plays the role of a domain-agnostic road-map for developing a knowledge graph of interlinked events. 	1808.02022	Saeedeh Shekarpour, Ankita Saxena, Krishnaprasad Thirunarayan, Valerie L. Shalin, Amit Sheth	2018-08-05		5	3	Principles for Developing a Knowledge Graph of Interlinked Events from News Headlines on Twitter		cs.CL, cs.AI, cs.IR	https://arxiv.org/pdf/1808.02022.pdf
350558	 What are the limits of automated Twitter sentiment classification? We analyze a large set of manually labeled tweets in different languages, use them as training data, and construct automated classification models. It turns out that the quality of classification models depends much more on the quality and size of training data than on the type of the model trained. Experimental results indicate that there is no statistically significant difference between the performance of the top classification models. We quantify the quality of training data by applying various annotator agreement measures, and identify the weakest points of different datasets. We show that the model performance approaches the inter-annotator agreement when the size of the training set is sufficiently large. However, it is crucial to regularly monitor the self- and inter-annotator agreements since this improves the training datasets and consequently the model performance. Finally, we show that there is strong evidence that humans perceive the sentiment classes (negative, neutral, and positive) as ordered. 	1602.07563	Igor Mozetic, Miha Grcar, Jasmina Smailovic	2016-02-24	10.1371/journal.pone.0155036	3	2	Multilingual Twitter Sentiment Classification: The Role of Human Annotators	2016-05-05	cs.CL, cs.AI	https://arxiv.org/pdf/1602.07563.pdf
463634	" Pathogenic Social Media (PSM) accounts such as terrorist supporters exploit large communities of supporters for conducting attacks on social media. Early detection of these accounts is crucial as they are high likely to be key users in making a harmful message ""viral"". In this paper, we make the first attempt on utilizing causal inference to identify PSMs within a short time frame around their activity. We propose a time-decay causality metric and incorporate it into a causal community detection-based algorithm. The proposed algorithm is applied to groups of accounts sharing similar causality features and is followed by a classification algorithm to classify accounts as PSM or not. Unlike existing techniques that take significant time to collect information such as network, cascade path, or content, our scheme relies solely on action log of users. Results on a real-world dataset from Twitter demonstrate effectiveness and efficiency of our approach. We achieved precision of 0.84 for detecting PSMs only based on their first 10 days of activity; the misclassified accounts were then detected 10 days later. "	1809.09331	Hamidreza Alvari, Elham Shaabani, Paulo Shakarian	2018-09-25		3	3	Early Identification of Pathogenic Social Media Accounts		cs.SI, cs.AI, cs.LG	https://arxiv.org/pdf/1809.09331.pdf
621606	 The enormous amount of texts published daily by Internet users has fostered the development of methods to analyze this content in several natural language processing areas, such as sentiment analysis. The main goal of this task is to classify the polarity of a message. Even though many approaches have been proposed for sentiment analysis, some of the most successful ones rely on the availability of large annotated corpus, which is an expensive and time-consuming process. In recent years, distant supervision has been used to obtain larger datasets. So, inspired by these techniques, in this paper we extend such approaches to incorporate popular graphic symbols used in electronic messages, the emojis, in order to create a large sentiment corpus for Portuguese. Trained on almost one million tweets, several models were tested in both same domain and cross-domain corpora. Our methods obtained very competitive results in five annotated corpora from mixed domains (Twitter and product reviews), which proves the domain-independent property of such approach. In addition, our results suggest that the combination of emoticons and emojis is able to properly capture the sentiment of a message. 	1707.02657	Edilson A. Corrêa, Vanessa Q. Marinho, Leandro B. dos Santos, Thales F. C. Bertaglia, Marcos V. Treviso, Henrico B. Brum	2017-07-09		6	3	PELESent: Cross-domain polarity classification using distant supervision		cs.CL, cs.AI, cs.LG	https://arxiv.org/pdf/1707.02657.pdf
647964	 This paper describes team Turing's submission to SemEval 2017 RumourEval: Determining rumour veracity and support for rumours (SemEval 2017 Task 8, Subtask A). Subtask A addresses the challenge of rumour stance classification, which involves identifying the attitude of Twitter users towards the truthfulness of the rumour they are discussing. Stance classification is considered to be an important step towards rumour verification, therefore performing well in this task is expected to be useful in debunking false rumours. In this work we classify a set of Twitter posts discussing rumours into either supporting, denying, questioning or commenting on the underlying rumours. We propose a LSTM-based sequential model that, through modelling the conversational structure of tweets, which achieves an accuracy of 0.784 on the RumourEval test set outperforming all other systems in Subtask A. 	1704.07221	Elena Kochkina, Maria Liakata, Isabelle Augenstein	2017-04-24		3	2	Turing at SemEval-2017 Task 8: Sequential Approach to Rumour Stance Classification with Branch-LSTM		cs.CL, cs.AI	https://arxiv.org/pdf/1704.07221.pdf
758406	 The rise in popularity and ubiquity of Twitter has made sentiment analysis of tweets an important and well-covered area of research. However, the 140 character limit imposed on tweets makes it hard to use standard linguistic methods for sentiment classification. On the other hand, what tweets lack in structure they make up with sheer volume and rich metadata. This metadata includes geolocation, temporal and author information. We hypothesize that sentiment is dependent on all these contextual factors. Different locations, times and authors have different emotional valences. In this paper, we explored this hypothesis by utilizing distant supervision to collect millions of labelled tweets from different locations, times and authors. We used this data to analyse the variation of tweet sentiments across different authors, times and locations. Once we explored and understood the relationship between these variables and sentiment, we used a Bayesian approach to combine these variables with more standard linguistic features such as n-grams to create a Twitter sentiment classifier. This combined classifier outperforms the purely linguistic classifier, showing that integrating the rich contextual information available on Twitter into sentiment classification is a promising direction of research. 	1605.05195	Soroush Vosoughi, Helen Zhou, Deb Roy	2016-05-17	10.18653/v1/W15-2904	3	4	Enhanced Twitter Sentiment Classification Using Contextual Information		cs.SI, cs.AI, cs.CL, cs.IR	https://arxiv.org/pdf/1605.05195.pdf
798320	 With the constant growth of the World Wide Web and the number of documents in different languages accordingly, the need for reliable language detection tools has increased as well. Platforms such as Twitter with predominantly short texts are becoming important information resources, which additionally imposes the need for short texts language detection algorithms. In this paper, we show how incorporating personalized user-specific information into the language detection algorithm leads to an important improvement of detection results. To choose the best algorithm for language detection for short text messages, we investigate several machine learning approaches. These approaches include the use of the well-known classifiers such as SVM and logistic regression, a dictionary based approach, and a probabilistic model based on modified Kneser-Ney smoothing. Furthermore, the extension of the probabilistic model to include additional user-specific information such as evidence accumulation per user and user interface language is explored, with the goal of improving the classification performance. The proposed approaches are evaluated on randomly collected Twitter data containing Latin as well as non-Latin alphabet languages and the quality of the obtained results is compared, followed by the selection of the best performing algorithm. This algorithm is then evaluated against two already existing general language detection tools: Chromium Compact Language Detector 2 (CLD2) and langid, where our method significantly outperforms the results achieved by both of the mentioned methods. Additionally, a preview of benefits and possible applications of having a reliable language detection algorithm is given. 	1608.08515	Ivana Balazevic, Mikio Braun, Klaus-Robert Müller	2016-08-30		3	2	Language Detection For Short Text Messages In Social Media		cs.CL, cs.AI	https://arxiv.org/pdf/1608.08515.pdf
820572	 Social messages classification is a research domain that has attracted the attention of many researchers in these last years. Indeed, the social message is different from ordinary text because it has some special characteristics like its shortness. Then the development of new approaches for the processing of the social message is now essential to make its classification more efficient. In this paper, we are mainly interested in the classification of social messages based on their spreading on online social networks (OSN). We proposed a new distance metric based on the Dynamic Time Warping distance and we use it with the probabilistic and the evidential k Nearest Neighbors (k-NN) classifiers to classify propagation networks (PrNets) of messages. The propagation network is a directed acyclic graph (DAG) that is used to record propagation traces of the message, the traversed links and their types. We tested the proposed metric with the chosen k-NN classifiers on real world propagation traces that were collected from Twitter social network and we got good classification accuracies. 	1701.07756	Siwar Jendoubi, Arnaud Martin, Ludovic Liétard, Boutheina Ben Yaghlane, Hend Ben Hadji	2017-01-26	10.1007/978-3-319-20807-7_38	5	3	Dynamic time warping distance for message propagation classification in Twitter		cs.AI, cs.SI, stat.ML	https://arxiv.org/pdf/1701.07756.pdf
869702	 Many aspects of people's lives are proven to be deeply connected to their jobs. In this paper, we first investigate the distinct characteristics of major occupation categories based on tweets. From multiple social media platforms, we gather several types of user information. From users' LinkedIn webpages, we learn their proficiencies. To overcome the ambiguity of self-reported information, a soft clustering approach is applied to extract occupations from crowd-sourced data. Eight job categories are extracted, including Marketing, Administrator, Start-up, Editor, Software Engineer, Public Relation, Office Clerk, and Designer. Meanwhile, users' posts on Twitter provide cues for understanding their linguistic styles, interests, and personalities. Our results suggest that people of different jobs have unique tendencies in certain language styles and interests. Our results also clearly reveal distinctive levels in terms of Big Five Traits for different jobs. Finally, a classifier is built to predict job types based on the features extracted from tweets. A high accuracy indicates a strong discrimination power of language features for job prediction task. 	1701.06233	Tianran Hu, Haoyuan Xiao, Thuy-vy Thi Nguyen, Jiebo Luo	2017-01-22		4	4	What the Language You Tweet Says About Your Occupation		cs.CY, cs.AI, cs.CL, cs.LG	https://arxiv.org/pdf/1701.06233.pdf
884239	 This paper introduces TwitterPaul, a system designed to make use of Social Media data to help to predict game outcomes for the 2010 FIFA World Cup tournament. To this end, we extracted over 538K mentions to football games from a large sample of tweets that occurred during the World Cup, and we classified into different types with a precision of up to 88%. The different mentions were aggregated in order to make predictions about the outcomes of the actual games. We attempt to learn which Twitter users are accurate predictors and explore several techniques in order to exploit this information to make more accurate predictions. We compare our results to strong baselines and against the betting line (prediction market) and found that the quality of extractions is more important than the quantity, suggesting that high precision methods working on a medium-sized dataset are preferable over low precision methods that use a larger amount of data. Finally, by aggregating some classes of predictions, the system performance is close to the one of the betting line. Furthermore, we believe that this domain independent framework can help to predict other sports, elections, product release dates and other future events that people talk about in social media. 	1211.6496	Naushad UzZaman, Roi Blanco, Michael Matthews	2012-11-27		3	3	TwitterPaul: Extracting and Aggregating Twitter Predictions	2012-11-30	cs.SI, cs.AI, physics.soc-ph	https://arxiv.org/pdf/1211.6496.pdf
