	abstract	arxiv_id	author_text	created	doi	num_authors	num_categories	title	updated	categories_str	url
1100245	 In the wake of a polarizing election, social media is laden with hateful content. To address various limitations of supervised hate speech classification methods including corpus bias and huge cost of annotation, we propose a weakly supervised two-path bootstrapping approach for an online hate speech detection model leveraging large-scale unlabeled data. This system significantly outperforms hate speech detection systems that are trained in a supervised manner using manually annotated data. Applying this model on a large quantity of tweets collected before, after, and on election day reveals motivations and patterns of inflammatory language. 	1710.07394	Lei Gao, Alexis Kuppersmith, Ruihong Huang	2017-10-19		3	1	Recognizing Explicit and Implicit Hate Speech Using a Weakly Supervised Two-path Bootstrapping Approach	2018-05-21	cs.CL	https://arxiv.org/pdf/1710.07394.pdf
1216918	 Computer systems need to be able to react to stress in order to perform optimally on some tasks. This article describes TensiStrength, a system to detect the strength of stress and relaxation expressed in social media text messages. TensiStrength uses a lexical approach and a set of rules to detect direct and indirect expressions of stress or relaxation, particularly in the context of transportation. It is slightly more effective than a comparable sentiment analysis program, although their similar performances occur despite differences on almost half of the tweets gathered. The effectiveness of TensiStrength depends on the nature of the tweets classified, with tweets that are rich in stress-related terms being particularly problematic. Although generic machine learning methods can give better performance than TensiStrength overall, they exploit topic-related terms in a way that may be undesirable in practical applications and that may not work as well in more focused contexts. In conclusion, TensiStrength and generic machine learning approaches work well enough to be practical choices for intelligent applications that need to take advantage of stress information, and the decision about which to use depends on the nature of the texts analysed and the purpose of the task. 	1607.00139	Mike Thelwall	2016-07-01	10.1016/j.ipm.2016.06.009	1	1	TensiStrength: Stress and relaxation magnitude detection for social media texts	2016-07-04	cs.CL	https://arxiv.org/pdf/1607.00139.pdf
1222117	 This article presents classifiers based on SVM and Convolutional Neural Networks (CNN) for the TASS 2017 challenge on tweets sentiment analysis. The classifier with the best performance in general uses a combination of SVM and CNN. The use of word embeddings was particularly useful for improving the classifiers performance. 	1710.06393	Aiala Rosá, Luis Chiruzzo, Mathias Etcheverry, Santiago Castro	2017-10-17		4	1	RETUYT in TASS 2017: Sentiment Analysis for Spanish Tweets using SVM and CNN		cs.CL	https://arxiv.org/pdf/1710.06393.pdf
1224811	" This paper describes Infosys's participation in the ""2nd Social Media Mining for Health Applications Shared Task at AMIA, 2017, Task 2"". Mining social media messages for health and drug related information has received significant interest in pharmacovigilance research. This task targets at developing automated classification models for identifying tweets containing descriptions of personal intake of medicines. Towards this objective we train a stacked ensemble of shallow convolutional neural network (CNN) models on an annotated dataset provided by the organizers. We use random search for tuning the hyper-parameters of the CNN and submit an ensemble of best models for the prediction task. Our system secured first place among 9 teams, with a micro-averaged F-score of 0.693. "	1803.07718	Jasper Friedrichs, Debanjan Mahata, Shubham Gupta	2018-03-20		3	1	InfyNLP at SMM4H Task 2: Stacked Ensemble of Shallow Convolutional Neural Networks for Identifying Personal Medication Intake from Twitter		cs.CL	https://arxiv.org/pdf/1803.07718.pdf
1241624	 We propose a new method to detect when users express the intent to leave a service, also known as churn. While previous work focuses solely on social media, we show that this intent can be detected in chatbot conversations. As companies increasingly rely on chatbots they need an overview of potentially churny users. To this end, we crowdsource and publish a dataset of churn intent expressions in chatbot interactions in German and English. We show that classifiers trained on social media data can detect the same intent in the context of chatbots. We introduce a classification architecture that outperforms existing work on churn intent detection in social media. Moreover, we show that, using bilingual word embeddings, a system trained on combined English and German data outperforms monolingual approaches. As the only existing dataset is in English, we crowdsource and publish a novel dataset of German tweets. We thus underline the universal aspect of the problem, as examples of churn intent in English help us identify churn in German tweets and chatbot conversations. 	1808.08432	Christian Abbet, Meryem M'hamdi, Athanasios Giannakopoulos, Robert West, Andreea Hossmann, Michael Baeriswyl, Claudiu Musat	2018-08-25		7	1	Churn Intent Detection in Multilingual Chatbot Conversations and Social Media		cs.CL	https://arxiv.org/pdf/1808.08432.pdf
1271345	 Topic Models have been reported to be beneficial for aspect-based sentiment analysis. This paper reports a simple topic model for sarcasm detection, a first, to the best of our knowledge. Designed on the basis of the intuition that sarcastic tweets are likely to have a mixture of words of both sentiments as against tweets with literal sentiment (either positive or negative), our hierarchical topic model discovers sarcasm-prevalent topics and topic-level sentiment. Using a dataset of tweets labeled using hashtags, the model estimates topic-level, and sentiment-level distributions. Our evaluation shows that topics such as `work', `gun laws', `weather' are sarcasm-prevalent topics. Our model is also able to discover the mixture of sentiment-bearing words that exist in a text of a given sentiment-related label. Finally, we apply our model to predict sarcasm in tweets. We outperform two prior work based on statistical classifiers with specific features, by around 25\%. 	1611.04326	Aditya Joshi, Prayas Jain, Pushpak Bhattacharyya, Mark Carman	2016-11-14		4	1	`Who would have thought of that!': A Hierarchical Topic Model for Extraction of Sarcasm-prevalent Topics and Sarcasm Detection	2016-11-22	cs.CL	https://arxiv.org/pdf/1611.04326.pdf
1313994	 In this paper, we describe how we created two state-of-the-art SVM classifiers, one to detect the sentiment of messages such as tweets and SMS (message-level task) and one to detect the sentiment of a term within a submissions stood first in both tasks on tweets, obtaining an F-score of 69.02 in the message-level task and 88.93 in the term-level task. We implemented a variety of surface-form, semantic, and sentiment features. with sentiment-word hashtags, and one from tweets with emoticons. In the message-level task, the lexicon-based features provided a gain of 5 F-score points over all others. Both of our systems can be replicated us available resources. 	1308.6242	Saif M. Mohammad, Svetlana Kiritchenko, Xiaodan Zhu	2013-08-28		3	1	NRC-Canada: Building the State-of-the-Art in Sentiment Analysis of Tweets		cs.CL	https://arxiv.org/pdf/1308.6242.pdf
1399554	" Social media users often make explicit predictions about upcoming events. Such statements vary in the degree of certainty the author expresses toward the outcome:""Leonardo DiCaprio will win Best Actor"" vs. ""Leonardo DiCaprio may win"" or ""No way Leonardo wins!"". Can popular beliefs on social media predict who will win? To answer this question, we build a corpus of tweets annotated for veridicality on which we train a log-linear classifier that detects positive veridicality with high precision. We then forecast uncertain outcomes using the wisdom of crowds, by aggregating users' explicit predictions. Our method for forecasting winners is fully automated, relying only on a set of contenders as input. It requires no training data of past outcomes and outperforms sentiment and tweet volume baselines on a broad range of contest prediction tasks. We further demonstrate how our approach can be used to measure the reliability of individual accounts' predictions and retrospectively identify surprise outcomes. "	1707.07212	Sandesh Swamy, Alan Ritter, Marie-Catherine de Marneffe	2017-07-22		3	1	"""i have a feeling trump will win.................."": Forecasting Winners and Losers from User Predictions on Twitter"	2017-08-31	cs.CL	https://arxiv.org/pdf/1707.07212.pdf
1416705	 Although, the fair amount of works in sentiment analysis (SA) and opinion mining (OM) systems in the last decade and with respect to the performance of these systems, but it still not desired performance, especially for morphologically-Rich Language (MRL) such as Arabic, due to the complexities and challenges exist in the nature of the languages itself. One of these challenges is the detection of idioms or proverbs phrases within the writer text or comment. An idiom or proverb is a form of speech or an expression that is peculiar to itself. Grammatically, it cannot be understood from the individual meanings of its elements and can yield different sentiment when treats as separate words. Consequently, In order to facilitate the task of detection and classification of lexical phrases for automated SA systems, this paper presents AIPSeLEX a novel idioms/ proverbs sentiment lexicon for modern standard Arabic (MSA) and colloquial. AIPSeLEX is manually collected and annotated at sentence level with semantic orientation (positive or negative). The efforts of manually building and annotating the lexicon are reported. Moreover, we build a classifier that extracts idioms and proverbs, phrases from text using n-gram and similarity measure methods. Finally, several experiments were carried out on various data, including Arabic tweets and Arabic microblogs (hotel reservation, product reviews, and TV program comments) from publicly available Arabic online reviews websites (social media, blogs, forums, e-commerce web sites) to evaluate the coverage and accuracy of AIPSeLEX. 	1506.01906	Hossam S. Ibrahim, Sherif M. Abdou, Mervat Gheith	2015-06-05	10.5120/20790-3435	3	1	Idioms-Proverbs Lexicon for Modern Standard Arabic and Colloquial Sentiment Analysis		cs.CL	https://arxiv.org/pdf/1506.01906.pdf
1429620	 This paper presents a computational approach to author profiling taking gender and language variety into account. We apply an ensemble system with the output of multiple linear SVM classifiers trained on character and word $n$-grams. We evaluate the system using the dataset provided by the organizers of the 2017 PAN lab on author profiling. Our approach achieved 75% average accuracy on gender identification on tweets written in four languages and 97% accuracy on language variety identification for Portuguese. 	1707.00621	Alina Maria Ciobanu, Marcos Zampieri, Shervin Malmasi, Liviu P. Dinu	2017-07-03		4	1	Including Dialects and Language Varieties in Author Profiling		cs.CL	https://arxiv.org/pdf/1707.00621.pdf
452111	 Using geometric data analysis, our objective is the analysis of narrative, with narrative of emotion being the focus in this work. The following two principles for analysis of emotion inform our work. Firstly, emotion is revealed not as a quality in its own right but rather through interaction. We study the 2-way relationship of Ilsa and Rick in the movie Casablanca, and the 3-way relationship of Emma, Charles and Rodolphe in the novel {\em Madame Bovary}. Secondly, emotion, that is expression of states of mind of subjects, is formed and evolves within the narrative that expresses external events and (personal, social, physical) context. In addition to the analysis methodology with key aspects that are innovative, the input data used is crucial. We use, firstly, dialogue, and secondly, broad and general description that incorporates dialogue. In a follow-on study, we apply our unsupervised narrative mapping to data streams with very low emotional expression. We map the narrative of Twitter streams. Thus we demonstrate map analysis of general narratives. 	1405.3539	Fionn Murtagh, Adam Ganz	2014-05-14		2	2	Pattern Recognition in Narrative: Tracking Emotional Expression in Context	2015-05-04	cs.AI, cs.CL	https://arxiv.org/pdf/1405.3539.pdf
567324	 We investigate evaluation metrics for dialogue response generation systems where supervised labels, such as task completion, are not available. Recent works in response generation have adopted metrics from machine translation to compare a model's generated response to a single target response. We show that these metrics correlate very weakly with human judgements in the non-technical Twitter domain, and not at all in the technical Ubuntu domain. We provide quantitative and qualitative results highlighting specific weaknesses in existing metrics, and provide recommendations for future development of better automatic evaluation metrics for dialogue systems. 	1603.08023	Chia-Wei Liu, Ryan Lowe, Iulian V. Serban, Michael Noseworthy, Laurent Charlin, Joelle Pineau	2016-03-25		6	4	How NOT To Evaluate Your Dialogue System: An Empirical Study of Unsupervised Evaluation Metrics for Dialogue Response Generation	2017-01-03	cs.CL, cs.AI, cs.LG, cs.NE	https://arxiv.org/pdf/1603.08023.pdf
581552	 We propose a framework for inferring the latent attitudes or preferences of users by performing probabilistic first-order logical reasoning over the social network graph. Our method answers questions about Twitter users like {\em Does this user like sushi?} or {\em Is this user a New York Knicks fan?} by building a probabilistic model that reasons over user attributes (the user's location or gender) and the social network (the user's friends and spouse), via inferences like homophily (I am more likely to like sushi if spouse or friends like sushi, I am more likely to like the Knicks if I live in New York). The algorithm uses distant supervision, semi-supervised data harvesting and vector space models to extract user attributes (e.g. spouse, education, location) and preferences (likes and dislikes) from text. The extracted propositions are then fed into a probabilistic reasoner (we investigate both Markov Logic and Probabilistic Soft Logic). Our experiments show that probabilistic logical reasoning significantly improves the performance on attribute and relation extraction, and also achieves an F-score of 0.791 at predicting a users likes or dislikes, significantly better than two strong baselines. 	1411.2679	Jiwei Li, Alan Ritter, Dan Jurafsky	2014-11-10		3	4	Inferring User Preferences by Probabilistic Logical Reasoning over Social Networks		cs.SI, cs.AI, cs.CL, cs.LG	https://arxiv.org/pdf/1411.2679.pdf
1083480	 Dating and romantic relationships not only play a huge role in our personal lives but also collectively influence and shape society. Today, many romantic partnerships originate from the Internet, signifying the importance of technology and the web in modern dating. In this paper, we present a text-based computational approach for estimating the relationship compatibility of two users on social media. Unlike many previous works that propose reciprocal recommender systems for online dating websites, we devise a distant supervision heuristic to obtain real world couples from social platforms such as Twitter. Our approach, the CoupleNet is an end-to-end deep learning based estimator that analyzes the social profiles of two users and subsequently performs a similarity match between the users. Intuitively, our approach performs both user profiling and match-making within a unified end-to-end framework. CoupleNet utilizes hierarchical recurrent neural models for learning representations of user profiles and subsequently coupled attention mechanisms to fuse information aggregated from two users. To the best of our knowledge, our approach is the first data-driven deep learning approach for our novel relationship recommendation problem. We benchmark our CoupleNet against several machine learning and deep learning baselines. Experimental results show that our approach outperforms all approaches significantly in terms of precision. Qualitative analysis shows that our model is capable of also producing explainable results to users. 	1805.11535	Yi Tay, Anh Tuan Luu, Siu Cheung Hui	2018-05-29		3	4	CoupleNet: Paying Attention to Couples with Coupled Attention for Relationship Recommendation		cs.CL, cs.AI, cs.IR, cs.NE	https://arxiv.org/pdf/1805.11535.pdf
1139891	 We study the extent to which we can infer users' geographical locations from social media. Location inference from social media can benefit many applications, such as disaster management, targeted advertising, and news content tailoring. In recent years, a number of algorithms have been proposed for identifying user locations on social media platforms such as Twitter and Facebook from message contents, friend networks, and interactions between users. In this paper, we propose a novel probabilistic model based on factor graphs for location inference that offers several unique advantages for this task. First, the model generalizes previous methods by incorporating content, network, and deep features learned from social context. The model is also flexible enough to support both supervised learning and semi-supervised learning. Second, we explore several learning algorithms for the proposed model, and present a Two-chain Metropolis-Hastings (MH+) algorithm, which improves the inference accuracy. Third, we validate the proposed model on three different genres of data - Twitter, Weibo, and Facebook - and demonstrate that the proposed model can substantially improve the inference accuracy (+3.3-18.5% by F1-score) over that of several state-of-the-art methods. 	1702.07281	Yujie Qian, Jie Tang, Zhilin Yang, Binxuan Huang, Wei Wei, Kathleen M. Carley	2017-02-23		6	2	A Probabilistic Framework for Location Inference from Social Media	2017-03-01	cs.AI, cs.SI	https://arxiv.org/pdf/1702.07281.pdf
983938	 Tencent Weibo, as one of the most popular micro-blogging services in China, has attracted millions of users, producing 30-60 millions of weibo (similar as tweet in Twitter) daily. With the overload problem of user generate content, Tencent users find it is more and more hard to browse and find valuable information at the first time. In this paper, we propose a Factor Graph based weibo recommendation algorithm TSI-WR (Topic-Level Social Influence based Weibo Recommendation), which could help Tencent users to find most suitable information. The main innovation is that we consider both direct and indirect social influence from topic level based on social balance theory. The main advantages of adopting this strategy are that it could first build a more accurate description of latent relationship between two users with weak connections, which could help to solve the data sparsity problem; second provide a more accurate recommendation for a certain user from a wider range. Other meaningful contextual information is also combined into our model, which include: Users profile, Users influence, Content of weibos, Topic information of weibos and etc. We also design a semi-supervised algorithm to further reduce the influence of data sparisty. The experiments show that all the selected variables are important and the proposed model outperforms several baseline methods. 	1210.7047	Daifeng Li, Zhipeng Luo, Golden Guo-zheng Sun, Jie Tang, Jingwei Zhang	2012-10-25		5	3	User-level Weibo Recommendation incorporating Social Influence based on Semi-Supervised Algorithm		cs.SI, cs.CY, cs.LG	https://arxiv.org/pdf/1210.7047.pdf
18556	 Due to the proliferation of online social networks (OSNs), users find themselves participating in multiple OSNs. These users leave their activity traces as they maintain friendships and interact with other users in these OSNs. In this work, we analyze how users maintain friendship in multiple OSNs by studying users who have accounts in both Twitter and Instagram. Specifically, we study the similarity of a user's friendship and the evenness of friendship distribution in multiple OSNs. Our study shows that most users in Twitter and Instagram prefer to maintain different friendships in the two OSNs, keeping only a small clique of common friends in across the OSNs. Based upon our empirical study, we conduct link prediction experiments to predict missing friendship links in multiple OSNs using the neighborhood features, neighborhood friendship maintenance features and cross-link features. Our link prediction experiments shows that un- supervised methods can yield good accuracy in predicting links in one OSN using another OSN data and the link prediction accuracy can be further improved using supervised method with friendship maintenance and others measures as features. 	1703.00857	Roy Ka-Wei Lee, Ee-Peng Lim	2017-03-02		2	2	Friendship Maintenance and Prediction in Multiple Social Networks		cs.SI, physics.soc-ph	https://arxiv.org/pdf/1703.00857.pdf
157755	 Online Social Networks (OSN) are increasingly being used as platform for an effective communication, to engage with other users, and to create a social worth via number of likes, followers and shares. Such metrics and crowd-sourced ratings give the OSN user a sense of social reputation which she tries to maintain and boost to be more influential. Users artificially bolster their social reputation via black-market web services. In this work, we identify users which manipulate their projected follower count using an unsupervised local neighborhood detection method. We identify a neighborhood of the user based on a robust set of features which reflect user similarity in terms of the expected follower count. We show that follower count estimation using our method has 84.2% accuracy with a low error rate. In addition, we estimate the follower count of the user under suspicion by finding its neighborhood drawn from a large random sample of Twitter. We show that our method is highly tolerant to synthetic manipulation of followers. Using the deviation of predicted follower count from the displayed count, we are also able to detect customers with a high precision of 98.62% 	1802.03625	Anupama Aggarwal, Saravana Kumar, Kushagra Bhargava, Ponnurangam Kumaraguru	2018-02-10		4	1	The Follower Count Fallacy: Detecting Twitter Users with Manipulated Follower Count		cs.SI	https://arxiv.org/pdf/1802.03625.pdf
201752	 Religiosity is a powerful force shaping human societies, affecting domains as diverse as economic growth or the ability to cope with illness. As more religious leaders and organizations as well as believers start using social networking sites (e.g., Twitter, Facebook), online activities become important extensions to traditional religious rituals and practices. However, there has been lack of research on religiosity in online social networks. This paper takes a step toward the understanding of several important aspects of religiosity on Twitter, based on the analysis of more than 250k U.S. users who self-declared their religions/belief, including Atheism, Buddhism, Christianity, Hinduism, Islam, and Judaism. Specifically, (i) we examine the correlation of geographic distribution of religious people between Twitter and offline surveys. (ii) We analyze users' tweets and networks to identify discriminative features of each religious group, and explore supervised methods to identify believers of different religions. (iii) We study the linkage preference of different religious groups, and observe a strong preference of Twitter users connecting to others sharing the same religion. 	1409.8578	Lu Chen, Ingmar Weber, Adam Okulicz-Kozaryn	2014-09-30		3	2	U.S. Religious Landscape on Twitter		cs.SI, physics.soc-ph	https://arxiv.org/pdf/1409.8578.pdf
204864	 In many social networks, several different link relations will exist between the same set of users. Additionally, attribute or textual information will be associated with those users, such as demographic details or user-generated content. For many data analysis tasks, such as community finding and data visualisation, the provision of multiple heterogeneous types of user data makes the analysis process more complex. We propose an unsupervised method for integrating multiple data views to produce a single unified graph representation, based on the combination of the k-nearest neighbour sets for users derived from each view. These views can be either relation-based or feature-based. The proposed method is evaluated on a number of annotated multi-view Twitter datasets, where it is shown to support the discovery of the underlying community structure in the data. 	1301.5809	Derek Greene, Pádraig Cunningham	2013-01-24		2	2	Producing a Unified Graph Representation from Multiple Social Network Views	2013-02-18	cs.SI, physics.soc-ph	https://arxiv.org/pdf/1301.5809.pdf
