	abstract	arxiv_id	author_text	created	doi	num_authors	num_categories	title	updated	categories_str	url
515203	 Detecting and preventing outbreaks of mosquito-borne diseases such as Dengue and Zika in Brasil and other tropical regions has long been a priority for governments in affected areas. Streaming social media content, such as Twitter, is increasingly being used for health vigilance applications such as flu detection. However, previous work has not addressed the complexity of drastic seasonal changes on Twitter content across multiple epidemic outbreaks. In order to address this gap, this paper contrasts two complementary approaches to detecting Twitter content that is relevant for Dengue outbreak detection, namely supervised classification and unsupervised clustering using topic modelling. Each approach has benefits and shortcomings. Our classifier achieves a prediction accuracy of about 80\% based on a small training set of about 1,000 instances, but the need for manual annotation makes it hard to track seasonal changes in the nature of the epidemics, such as the emergence of new types of virus in certain geographical locations. In contrast, LDA-based topic modelling scales well, generating cohesive and well-separated clusters from larger samples. While clusters can be easily re-generated following changes in epidemics, however, this approach makes it hard to clearly segregate relevant tweets into well-defined clusters. 	1605.00968	Paolo Missier, Alexander Romanovsky, Tudor Miu, Atinder Pal, Michael Daniilakis, Alessandro Garcia, Diego Cedrim, Leonardo da Silva Sousa	2016-05-03		8	1	Tracking Dengue Epidemics using Twitter Content Classification and Topic Modelling		cs.SI	https://arxiv.org/pdf/1605.00968.pdf
536645	 Twitter is often referred to as a backchannel for conferences. While the main conference takes place in a physical setting, attendees and virtual attendees socialize, introduce new ideas or broadcast information by microblogging on Twitter. In this paper we analyze the scholars' Twitter use in 16 Computer Science conferences over a timespan of five years. Our primary finding is that over the years there are increasing differences with respect to conversation use and information use in Twitter. We studied the interaction network between users to understand whether assumptions about the structure of the conversations hold over time and between different types of interactions, such as retweets, replies, and mentions. While `people come and people go', we want to understand what keeps people stay with the conference on Twitter. By casting the problem to a classification task, we find different factors that contribute to the continuing participation of users to the online Twitter conference activity. These results have implications for research communities to implement strategies for continuous and active participation among members. 	1403.7772	Xidao Wen, Yu-Ru Lin, Christoph Trattner, Denis Parra	2014-03-30		4	3	Twitter in Academic Conferences: Usage, Networking and Participation over Time		cs.SI, cs.CY, physics.soc-ph	https://arxiv.org/pdf/1403.7772.pdf
542611	 Currency trading (Forex) is the largest world market in terms of volume. We analyze trading and tweeting about the EUR-USD currency pair over a period of three years. First, a large number of tweets were manually labeled, and a Twitter stance classification model is constructed. The model then classifies all the tweets by the trading stance signal: buy, hold, or sell (EUR vs. USD). The Twitter stance is compared to the actual currency rates by applying the event study methodology, well-known in financial economics. It turns out that there are large differences in Twitter stance distribution and potential trading returns between the four groups of Twitter users: trading robots, spammers, trading companies, and individual traders. Additionally, we observe attempts of reputation manipulation by post festum removal of tweets with poor predictions, and deleting/reposting of identical tweets to increase the visibility without tainting one's Twitter timeline. 	1804.02233	Igor Mozetič, Peter Gabrovšek, Petra Kralj Novak	2018-04-06		3	4	Forex trading and Twitter: Spam, bots, and reputation manipulation	2018-04-16	cs.SI, cs.CL, cs.CY, econ.TH	https://arxiv.org/pdf/1804.02233.pdf
548431	 Digital traces of conversations in micro-blogging platforms and OSNs provide information about user opinion with a high degree of resolution. These information sources can be exploited to under- stand and monitor collective behaviors. In this work, we focus on polarization classes, i.e., those topics that require the user to side exclusively with one position. The proposed method provides an iterative classification of users and keywords: first, polarized users are identified, then polarized keywords are discovered by monitoring the activities of previously classified users. This method thus allows tracking users and topics over time. We report several experiments conducted on two Twitter datasets during political election time-frames. We measure the user classification accuracy on a golden set of users, and analyze the relevance of the extracted keywords for the ongoing political discussion. 	1610.08686	Mauro Coletto, Claudio Lucchese, Salvatore Orlando, Raffaele Perego	2016-10-27		4	1	Polarized User and Topic Tracking in Twitter		cs.SI	https://arxiv.org/pdf/1610.08686.pdf
550408	 Nationality identification unlocks important demographic information, with many applications in biomedical and sociological research. Existing name-based nationality classifiers use name substrings as features and are trained on small, unrepresentative sets of labeled names, typically extracted from Wikipedia. As a result, these methods achieve limited performance and cannot support fine-grained classification. We exploit the phenomena of homophily in communication patterns to learn name embeddings, a new representation that encodes gender, ethnicity, and nationality which is readily applicable to building classifiers and other systems. Through our analysis of 57M contact lists from a major Internet company, we are able to design a fine-grained nationality classifier covering 39 groups representing over 90% of the world population. In an evaluation against other published systems over 13 common classes, our F1 score (0.795) is substantial better than our closest competitor Ethnea (0.580). To the best of our knowledge, this is the most accurate, fine-grained nationality classifier available. As a social media application, we apply our classifiers to the followers of major Twitter celebrities over six different domains. We demonstrate stark differences in the ethnicities of the followers of Trump and Obama, and in the sports and entertainments favored by different groups. Finally, we identify an anomalous political figure whose presumably inflated following appears largely incapable of reading the language he posts in. 	1708.07903	Junting Ye, Shuchu Han, Yifan Hu, Baris Coskun, Meizhu Liu, Hong Qin, Steven Skiena	2017-08-25		7	2	Nationality Classification Using Name Embeddings		cs.SI, cs.CL	https://arxiv.org/pdf/1708.07903.pdf
562292	 Increasing evidence suggests that a growing amount of social media content is generated by autonomous entities known as social bots. In this work we present a framework to detect such entities on Twitter. We leverage more than a thousand features extracted from public data and meta-data about users: friends, tweet content and sentiment, network patterns, and activity time series. We benchmark the classification framework by using a publicly available dataset of Twitter bots. This training data is enriched by a manually annotated collection of active Twitter users that include both humans and bots of varying sophistication. Our models yield high accuracy and agreement with each other and can detect bots of different nature. Our estimates suggest that between 9% and 15% of active Twitter accounts are bots. Characterizing ties among accounts, we observe that simple bots tend to interact with bots that exhibit more human-like behaviors. Analysis of content flows reveals retweet and mention strategies adopted by bots to interact with different target groups. Using clustering analysis, we characterize several subclasses of accounts, including spammers, self promoters, and accounts that post content from connected applications. 	1703.03107	Onur Varol, Emilio Ferrara, Clayton A. Davis, Filippo Menczer, Alessandro Flammini	2017-03-08		5	1	Online Human-Bot Interactions: Detection, Estimation, and Characterization	2017-03-27	cs.SI	https://arxiv.org/pdf/1703.03107.pdf
576216	 Twitter is used for a variety of reasons, including information dissemination, marketing, political organizing and to spread propaganda, spamming, promotion, conversations, and so on. Characterizing these activities and categorizing associated user generated content is a challenging task. We present a information-theoretic approach to classification of user activity on Twitter. We focus on tweets that contain embedded URLs and study their collective `retweeting' dynamics. We identify two features, time-interval and user entropy, which we use to classify retweeting activity. We achieve good separation of different activities using just these two features and are able to categorize content based on the collective user response it generates. We have identified five distinct categories of retweeting activity on Twitter: automatic/robotic activity, newsworthy information dissemination, advertising and promotion, campaigns, and parasitic advertisement. In the course of our investigations, we have shown how Twitter can be exploited for promotional and spam-like activities. The content-independent, entropy-based activity classification method is computationally efficient, scalable and robust to sampling and missing data. It has many applications, including automatic spam-detection, trend identification, trust management, user-modeling, social search and content classification on online social media. 	1106.0346	Rumi Ghosh, Tawan Surachawala, Kristina Lerman	2011-06-01		3	2	Entropy-based Classification of 'Retweeting' Activity on Twitter		cs.SI, cs.CY	https://arxiv.org/pdf/1106.0346.pdf
594619	 Recent research has shown a substantial active presence of bots in online social networks (OSNs). In this paper we utilise our past work on studying bots (Stweeler) to comparatively analyse the usage and impact of bots and humans on Twitter, one of the largest OSNs in the world. We collect a large-scale Twitter dataset and define various metrics based on tweet metadata. We divide and filter the dataset in four popularity groups in terms of number of followers. Using a human annotation task we assign 'bot' and 'human' ground-truth labels to the dataset, and compare the annotations against an online bot detection tool for evaluation. We then ask a series of questions to discern important behavioural bot and human characteristics using metrics within and among four popularity groups. From the comparative analysis we draw important differences as well as surprising similarities between the two entities, thus paving the way for reliable classification of automated political infiltration, advertisement campaigns, and general bot detection. 	1704.01508	Zafar Gilani, Reza Farahbakhsh, Gareth Tyson, Liang Wang, Jon Crowcroft	2017-04-05		5	1	An in-depth characterisation of Bots and Humans on Twitter		cs.SI	https://arxiv.org/pdf/1704.01508.pdf
608699	 Breaking news leads to situations of fast-paced reporting in social media, producing all kinds of updates related to news stories, albeit with the caveat that some of those early updates tend to be rumours, i.e., information with an unverified status at the time of posting. Flagging information that is unverified can be helpful to avoid the spread of information that may turn out to be false. Detection of rumours can also feed a rumour tracking system that ultimately determines their veracity. In this paper we introduce a novel approach to rumour detection that learns from the sequential dynamics of reporting during breaking news in social media to detect rumours in new stories. Using Twitter datasets collected during five breaking news stories, we experiment with Conditional Random Fields as a sequential classifier that leverages context learnt during an event for rumour detection, which we compare with the state-of-the-art rumour detection system as well as other baselines. In contrast to existing work, our classifier does not need to observe tweets querying a piece of information to deem it a rumour, but instead we detect rumours from the tweet alone by exploiting context learnt during the event. Our classifier achieves competitive performance, beating the state-of-the-art classifier that relies on querying tweets with improved precision and recall, as well as outperforming our best baseline with nearly 40% improvement in terms of F1 score. The scale and diversity of our experiments reinforces the generalisability of our classifier. 	1610.07363	Arkaitz Zubiaga, Maria Liakata, Rob Procter	2016-10-24		3	3	Learning Reporting Dynamics during Breaking News for Rumour Detection in Social Media		cs.CL, cs.IR, cs.SI	https://arxiv.org/pdf/1610.07363.pdf
629780	 To deal with the sheer volume of information and gain competitive advantage, the news industry has started to explore and invest in news automation. In this paper, we present Reuters Tracer, a system that automates end-to-end news production using Twitter data. It is capable of detecting, classifying, annotating, and disseminating news in real time for Reuters journalists without manual intervention. In contrast to other similar systems, Tracer is topic and domain agnostic. It has a bottom-up approach to news detection, and does not rely on a predefined set of sources or subjects. Instead, it identifies emerging conversations from 12+ million tweets per day and selects those that are news-like. Then, it contextualizes each story by adding a summary and a topic to it, estimating its newsworthiness, veracity, novelty, and scope, and geotags it. Designing algorithms to generate news that meets the standards of Reuters journalists in accuracy and timeliness is quite challenging. But Tracer is able to achieve competitive precision, recall, timeliness, and veracity on news detection and delivery. In this paper, we reveal our key algorithm designs and evaluations that helped us achieve this goal, and lessons learned along the way. 	1711.04068	Xiaomo Liu, Armineh Nourbakhsh, Quanzhi Li, Sameena Shah, Robert Martin, John Duprey	2017-11-10		6	1	Reuters Tracer: Toward Automated News Production Using Large Scale Social Media Data		cs.SI	https://arxiv.org/pdf/1711.04068.pdf
658669	 In the widely used message platform Twitter, about 2% of the tweets contains the geographical location through exact GPS coordinates (latitude and longitude). Knowing the location of a tweet is useful for many data analytics questions. This research is looking at the determination of a location for tweets that do not contain GPS coordinates. An accuracy of 82% was achieved using a Naive Bayes model trained on features such as the users' timezone, the user's language, and the parsed user location. The classifier performs well on active Twitter countries such as the Netherlands and United Kingdom. An analysis of errors made by the classifier shows that mistakes were made due to limited information and shared properties between countries such as shared timezone. A feature analysis was performed in order to see the effect of different features. The features timezone and parsed user location were the most informative features. 	1508.02483	Han van der Veen, Djoerd Hiemstra, Tijs van den Broek, Michel Ehrenhard, Ariana Need	2015-08-11		5	1	Determine the User Country of a Tweet		cs.SI	https://arxiv.org/pdf/1508.02483.pdf
663027	 Background: Micro-blogging services such as Twitter offer the potential to crowdsource epidemics in real-time. However, Twitter posts ('tweets') are often ambiguous and reactive to media trends. In order to ground user messages in epidemic response we focused on tracking reports of self-protective behaviour such as avoiding public gatherings or increased sanitation as the basis for further risk analysis. Results: We created guidelines for tagging self protective behaviour based on Jones and Salath\'e (2009)'s behaviour response survey. Applying the guidelines to a corpus of 5283 Twitter messages related to influenza like illness showed a high level of inter-annotator agreement (kappa 0.86). We employed supervised learning using unigrams, bigrams and regular expressions as features with two supervised classifiers (SVM and Naive Bayes) to classify tweets into 4 self-reported protective behaviour categories plus a self-reported diagnosis. In addition to classification performance we report moderately strong Spearman's Rho correlation by comparing classifier output against WHO/NREVSS laboratory data for A(H1N1) in the USA during the 2009-2010 influenza season. Conclusions: The study adds to evidence supporting a high degree of correlation between pre-diagnostic social media signals and diagnostic influenza case data, pointing the way towards low cost sensor networks. We believe that the signals we have modelled may be applicable to a wide range of diseases. 	1110.3089	Nigel Collier, Nguyen Truong Son, Ngoc Mai Nguyen	2011-10-13	10.1186/2041-1480-2-S5-S9	3	3	OMG U got flu? Analysis of shared health messages for bio-surveillance		cs.CL, cs.IR, cs.SI	https://arxiv.org/pdf/1110.3089.pdf
677410	 The link between affect, defined as the capacity for sentimental arousal on the part of a message, and virality, defined as the probability that it be sent along, is of significant theoretical and practical importance, e.g. for viral marketing. A quantitative study of emailing of articles from the NY Times finds a strong link between positive affect and virality, and, based on psychological theories it is concluded that this relation is universally valid. The conclusion appears to be in contrast with classic theory of diffusion in news media emphasizing negative affect as promoting propagation. In this paper we explore the apparent paradox in a quantitative analysis of information diffusion on Twitter. Twitter is interesting in this context as it has been shown to present both the characteristics social and news media. The basic measure of virality in Twitter is the probability of retweet. Twitter is different from email in that retweeting does not depend on pre-existing social relations, but often occur among strangers, thus in this respect Twitter may be more similar to traditional news media. We therefore hypothesize that negative news content is more likely to be retweeted, while for non-news tweets positive sentiments support virality. To test the hypothesis we analyze three corpora: A complete sample of tweets about the COP15 climate summit, a random sample of tweets, and a general text corpus including news. The latter allows us to train a classifier that can distinguish tweets that carry news and non-news information. We present evidence that negative sentiment enhances virality in the news segment, but not in the non-news segment. We conclude that the relation between affect and virality is more complex than expected based on the findings of Berger and Milkman (2010), in short 'if you want to be cited: Sweet talk your friends or serve bad news to the public'. 	1101.0510	Lars Kai Hansen, Adam Arvidsson, Finn Årup Nielsen, Elanor Colleoni, Michael Etter	2011-01-03		5	3	Good Friends, Bad News - Affect and Virality in Twitter		cs.SI, cs.CL, physics.soc-ph	https://arxiv.org/pdf/1101.0510.pdf
682290	 The growing incidents of counterfeiting and associated economic and health consequences necessitate the development of active surveillance systems capable of producing timely and reliable information for all stake holders in the anti-counterfeiting fight. User generated content from social media platforms can provide early clues about product allergies, adverse events and product counterfeiting. This paper reports a work in progresswith contributions including: the development of a framework for gathering and analyzing the views and experiences of users of drug and cosmetic products using machine learning, text mining and sentiment analysis, the application of the proposed framework on Facebook comments and data from Twitter for brand analysis, and the description of how to develop a product safety lexicon and training data for modeling a machine learning classifier for drug and cosmetic product sentiment prediction. The initial brand and product comparison results signify the usefulness of text mining and sentiment analysis on social media data while the use of machine learning classifier for predicting the sentiment orientation provides a useful tool for users, product manufacturers, regulatory and enforcement agencies to monitor brand or product sentiment trends in order to act in the event of sudden or significant rise in negative sentiment. 	1510.05301	Haruna Isah, Daniel Neagu, Paul Trundle	2015-10-18	10.1109/UKCI.2014.6930158	3	2	Social Media Analysis for Product Safety using Text Mining and Sentiment Analysis		cs.SI, cs.IR	https://arxiv.org/pdf/1510.05301.pdf
687568	 We present a new algorithm for inferring the home location of Twitter users at different granularities, including city, state, time zone or geographic region, using the content of users tweets and their tweeting behavior. Unlike existing approaches, our algorithm uses an ensemble of statistical and heuristic classifiers to predict locations and makes use of a geographic gazetteer dictionary to identify place-name entities. We find that a hierarchical classification approach, where time zone, state or geographic region is predicted first and city is predicted next, can improve prediction accuracy. We have also analyzed movement variations of Twitter users, built a classifier to predict whether a user was travelling in a certain period of time and use that to further improve the location detection accuracy. Experimental evidence suggests that our algorithm works well in practice and outperforms the best existing algorithms for predicting the home location of Twitter users. 	1403.2345	Jalal Mahmud, Jeffrey Nichols, Clemens Drews	2014-03-07		3	3	Home Location Identification of Twitter Users		cs.SI, cs.CL, cs.CY	https://arxiv.org/pdf/1403.2345.pdf
695345	 Internet is fast becoming critically important to commerce, industry and individuals. Search Engine (SE) is the most vital component for communication network and also used for discover information for users or people. Search engine optimization (SEO) is the process that is mostly used to increasing traffic from free, organic or natural listings on search engines and also helps to increase website ranking. It includes techniques like link building, directory submission, classified submission etc. but SMO, on the other hand, is the process of promoting your website on social media platforms. It includes techniques like RSS feeds, social news and bookmarking sites, video and blogging sites, as well as social networking sites, such as Facebook, Twitter, Google+, Tumblr, Pinterest, Instagram etc.Social media optimization is becoming increasingly important for search engine optimization, as search engines are increasingly utilizing the recommendations of users of social networks to rank pages in the search engine result pages. Since it is more difficult to tip the influence the search engines in this way. Social Media Optimization (SMO) may also use to generate traffic on a website, promote your business at the center of social marketing place and increase ranking. 	1408.0332	Dushyant Vaghela	2014-08-01		1	1	Social Media Impact on Website Ranking		cs.SI	https://arxiv.org/pdf/1408.0332.pdf
698015	 Existence of spam URLs over emails and Online Social Media (OSM) has become a growing phenomenon. To counter the dissemination issues associated with long complex URLs in emails and character limit imposed on various OSM (like Twitter), the concept of URL shortening gained a lot of traction. URL shorteners take as input a long URL and give a short URL with the same landing page in return. With its immense popularity over time, it has become a prime target for the attackers giving them an advantage to conceal malicious content. Bitly, a leading service in this domain is being exploited heavily to carry out phishing attacks, work from home scams, pornographic content propagation, etc. This imposes additional performance pressure on Bitly and other URL shorteners to be able to detect and take a timely action against the illegitimate content. In this study, we analyzed a dataset marked as suspicious by Bitly in the month of October 2013 to highlight some ground issues in their spam detection mechanism. In addition, we identified some short URL based features and coupled them with two domain specific features to classify a Bitly URL as malicious / benign and achieved a maximum accuracy of 86.41%. To the best of our knowledge, this is the first large scale study to highlight the issues with Bitly's spam detection policies and proposing a suitable countermeasure. 	1405.1511	Neha Gupta, Ponnurangam Kumaraguru	2014-05-07		2	2	Exploration of gaps in Bitly's spam detection and relevant counter measures		cs.SI, cs.IR	https://arxiv.org/pdf/1405.1511.pdf
