	abstract	arxiv_id	author_text	created	doi	num_authors	num_categories	title	updated	categories_str	url
235668	 Mining social media messages such as tweets, articles, and Facebook posts for health and drug related information has received significant interest in pharmacovigilance research. Social media sites (e.g., Twitter), have been used for monitoring drug abuse, adverse reactions of drug usage and analyzing expression of sentiments related to drugs. Most of these studies are based on aggregated results from a large population rather than specific sets of individuals. In order to conduct studies at an individual level or specific cohorts, identifying posts mentioning intake of medicine by the user is necessary. Towards this objective we develop a classifier for identifying mentions of personal intake of medicine in tweets. We train a stacked ensemble of shallow convolutional neural network (CNN) models on an annotated dataset. We use random search for tuning the hyper-parameters of the CNN models and present an ensemble of best models for the prediction task. Our system produces state-of-the-art result, with a micro-averaged F-score of 0.693. We believe that the developed classifier has direct uses in the areas of psychology, health informatics, pharmacovigilance and affective computing for tracking moods, emotions and sentiments of patients expressing intake of medicine in social media. 	1808.02082	Debanjan Mahata, Jasper Friedrichs, Rajiv Ratn Shah, Jing Jiang	2018-08-02		4	1	Did you take the pill? - Detecting Personal Intake of Medicine from Twitter		cs.CL	https://arxiv.org/pdf/1808.02082.pdf
294974	 Word embeddings and convolutional neural networks (CNN) have attracted extensive attention in various classification tasks for Twitter, e.g. sentiment classification. However, the effect of the configuration used to train and generate the word embeddings on the classification performance has not been studied in the existing literature. In this paper, using a Twitter election classification task that aims to detect election-related tweets, we investigate the impact of the background dataset used to train the embedding models, the context window size and the dimensionality of word embeddings on the classification performance. By comparing the classification results of two word embedding models, which are trained using different background corpora (e.g. Wikipedia articles and Twitter microposts), we show that the background data type should align with the Twitter classification dataset to achieve a better performance. Moreover, by evaluating the results of word embeddings models trained using various context window sizes and dimensionalities, we found that large context window and dimension sizes are preferable to improve the performance. Our experimental results also show that using word embeddings and CNN leads to statistically significant improvements over various baselines such as random, SVM with TF-IDF and SVM with word embeddings. 	1606.07006	Xiao Yang, Craig Macdonald, Iadh Ounis	2016-06-22		3	2	Using Word Embeddings in Twitter Election Classification	2017-03-21	cs.IR, cs.CL	https://arxiv.org/pdf/1606.07006.pdf
328221	" Social media datasets, especially Twitter tweets, are popular in the field of text classification. Tweets are a valuable source of micro-text (sometimes referred to as ""micro-blogs""), and have been studied in domains such as sentiment analysis, recommendation systems, spam detection, clustering, among others. Tweets often include keywords referred to as ""Hashtags"" that can be used as labels for the tweet. Using tweets encompassing 50 labels, we studied the impact of word versus character-level feature selection and extraction on different learners to solve a multi-class classification task. We show that feature extraction of simple character-level groups performs better than simple word groups and pre-processing methods like normalizing using Porter's Stemming and Part-of-Speech (""POS"")-Lemmatization. "	1708.08123	Ankit Vadehra, Maura R. Grossman, Gordon V. Cormack	2017-08-27		3	2	Impact of Feature Selection on Micro-Text Classification		cs.IR, cs.CL	https://arxiv.org/pdf/1708.08123.pdf
328330	" The effect of amplifiers, downtoners, and negations has been studied in general and particularly in the context of sentiment analysis. However, there is only limited work which aims at transferring the results and methods to discrete classes of emotions, e. g., joy, anger, fear, sadness, surprise, and disgust. For instance, it is not straight-forward to interpret which emotion the phrase ""not happy"" expresses. With this paper, we aim at obtaining a better understanding of such modifiers in the context of emotion-bearing words and their impact on document-level emotion classification, namely, microposts on Twitter. We select an appropriate scope detection method for modifiers of emotion words, incorporate it in a document-level emotion classification model as additional bag of words and show that this approach improves the performance of emotion classification. In addition, we build a term weighting approach based on the different modifiers into a lexical model for the analysis of the semantics of modifiers and their impact on emotion meaning. We show that amplifiers separate emotions expressed with an emotion- bearing word more clearly from other secondary connotations. Downtoners have the opposite effect. In addition, we discuss the meaning of negations of emotion-bearing words. For instance we show empirically that ""not happy"" is closer to sadness than to anger and that fear-expressing words in the scope of downtoners often express surprise. "	1808.10653	Florian Strohm, Roman Klinger	2018-08-31		2	1	An Empirical Analysis of the Role of Amplifiers, Downtoners, and Negations in Emotion Classification in Microblogs		cs.CL	https://arxiv.org/pdf/1808.10653.pdf
338381	 Given the growing assortment of sentiment measuring instruments, it is imperative to understand which aspects of sentiment dictionaries contribute to both their classification accuracy and their ability to provide richer understanding of texts. Here, we perform detailed, quantitative tests and qualitative assessments of 6 dictionary-based methods applied, and briefly examine a further 20 methods. We show that while inappropriate for sentences, dictionary-based methods are generally robust in their classification accuracy for longer texts. Stories often following distinct emotional trajectories, forming patterns that are meaningful to us. By classifying the emotional arcs for a filtered subset of 4,803 stories from Project Gutenberg's fiction collection, we find a set of six core trajectories which form the building blocks of complex narratives. Of profound scientific interest will be the degree to which we can eventually understand the full landscape of human stories, and data driven approaches will play a crucial role. Finally, we utilize web-scale data from Twitter to study the limits of what social data can tell us about public health, mental illness, discourse around the protest movement of #BlackLivesMatter, discourse around climate change, and hidden networks. We conclude with a review of published works in complex systems that separately analyze charitable donations, the happiness of words in 10 languages, 100 years of daily temperature data across the United States, and Australian Rules Football games. 	1712.06163	Andrew J. Reagan	2017-12-17		1	1	Towards a science of human stories: using sentiment analysis and emotional arcs to understand the building blocks of complex social systems		cs.CL	https://arxiv.org/pdf/1712.06163.pdf
352680	 Sentiment Analysis in Arabic is a challenging task due to the rich morphology of the language. Moreover, the task is further complicated when applied to Twitter data that is known to be highly informal and noisy. In this paper, we develop a hybrid method for sentiment analysis for Arabic tweets for a specific Arabic dialect which is the Saudi Dialect. Several features were engineered and evaluated using a feature backward selection method. Then a hybrid method that combines a corpus-based and lexicon-based method was developed for several classification models (two-way, three-way, four-way). The best F1-score for each of these models was (69.9,61.63,55.07) respectively. 	1805.08533	Nora Al-Twairesh, Hend Al-Khalifa, AbdulMalik Alsalman, Yousef Al-Ohali	2018-05-22		4	1	Sentiment Analysis of Arabic Tweets: Feature Engineering and A Hybrid Approach		cs.CL	https://arxiv.org/pdf/1805.08533.pdf
366677	 The ability to accurately represent sentences is central to language understanding. We describe a convolutional architecture dubbed the Dynamic Convolutional Neural Network (DCNN) that we adopt for the semantic modelling of sentences. The network uses Dynamic k-Max Pooling, a global pooling operation over linear sequences. The network handles input sentences of varying length and induces a feature graph over the sentence that is capable of explicitly capturing short and long-range relations. The network does not rely on a parse tree and is easily applicable to any language. We test the DCNN in four experiments: small scale binary and multi-class sentiment prediction, six-way question classification and Twitter sentiment prediction by distant supervision. The network achieves excellent performance in the first three tasks and a greater than 25% error reduction in the last task with respect to the strongest baseline. 	1404.2188	Nal Kalchbrenner, Edward Grefenstette, Phil Blunsom	2014-04-08		3	1	A Convolutional Neural Network for Modelling Sentences		cs.CL	https://arxiv.org/pdf/1404.2188.pdf
428317	 This paper addresses the task of user gender classification in social media, with an application to Twitter. The approach automatically predicts gender by leveraging observable information such as the tweet behavior, linguistic content of the user's Twitter feed and the celebrities followed by the user. This paper first evaluates linguistic content based features using LIWC dictionary and popular neighborhood features using Wikipedia and Freebase. Then augments both features which yielded a significant increase in the accuracy for gender prediction. Results show that rich linguistic features combined with popular neighborhood prove valuables and promising for additional user classification needs. 	1405.6667	Puneet Singh Ludu	2014-05-26		1	2	Inferring gender of a Twitter user using celebrities it follows		cs.IR, cs.CL	https://arxiv.org/pdf/1405.6667.pdf
497980	 The utilization of social media material in journalistic workflows is increasing, demanding automated methods for the identification of mis- and disinformation. Since textual contradiction across social media posts can be a signal of rumorousness, we seek to model how claims in Twitter posts are being textually contradicted. We identify two different contexts in which contradiction emerges: its broader form can be observed across independently posted tweets and its more specific form in threaded conversations. We define how the two scenarios differ in terms of central elements of argumentation: claims and conversation structure. We design and evaluate models for the two scenarios uniformly as 3-way Recognizing Textual Entailment tasks in order to represent claims and conversation structure implicitly in a generic inference model, while previous studies used explicit or no representation of these properties. To address noisy text, our classifiers use simple similarity features derived from the string and part-of-speech level. Corpus statistics reveal distribution differences for these features in contradictory as opposed to non-contradictory tweet relations, and the classifiers yield state of the art performance. 	1611.02588	Piroska Lendvai, Uwe D. Reichel	2016-11-08		2	1	Contradiction Detection for Rumorous Claims	2016-11-11	cs.CL	https://arxiv.org/pdf/1611.02588.pdf
500073	 In the age of social news, it is important to understand the types of reactions that are evoked from news sources with various levels of credibility. In the present work we seek to better understand how users react to trusted and deceptive news sources across two popular, and very different, social media platforms. To that end, (1) we develop a model to classify user reactions into one of nine types, such as answer, elaboration, and question, etc, and (2) we measure the speed and the type of reaction for trusted and deceptive news sources for 10.8M Twitter posts and 6.2M Reddit comments. We show that there are significant differences in the speed and the type of reactions between trusted and deceptive news sources on Twitter, but far smaller differences on Reddit. 	1805.12032	Maria Glenski, Tim Weninger, Svitlana Volkova	2018-05-30		3	1	Identifying and Understanding User Reactions to Deceptive and Trusted Social News Sources		cs.CL	https://arxiv.org/pdf/1805.12032.pdf
548254	 We propose MVCNN, a convolution neural network (CNN) architecture for sentence classification. It (i) combines diverse versions of pretrained word embeddings and (ii) extracts features of multigranular phrases with variable-size convolution filters. We also show that pretraining MVCNN is critical for good performance. MVCNN achieves state-of-the-art performance on four tasks: on small-scale binary, small-scale multi-class and largescale Twitter sentiment prediction and on subjectivity classification. 	1603.04513	Wenpeng Yin, Hinrich Schütze	2016-03-14		2	1	Multichannel Variable-Size Convolution for Sentence Classification		cs.CL	https://arxiv.org/pdf/1603.04513.pdf
573370	 We present results of empirical studies on positive speech on Twitter. By positive speech we understand speech that works for the betterment of a given situation, in this case relations between different communities in a conflict-prone country. We worked with four Twitter data sets. Through semi-manual opinion mining, we found that positive speech accounted for < 1% of the data . In fully automated studies, we tested two approaches: unsupervised statistical analysis, and supervised text classification based on distributed word representation. We discuss benefits and challenges of those approaches and report empirical evidence obtained in the study. 	1702.08866	Marina Sokolova, Vera Sazonova, Kanyi Huang, Rudraneel Chakraboty, Stan Matwin	2017-02-24		5	1	Studying Positive Speech on Twitter		cs.CL	https://arxiv.org/pdf/1702.08866.pdf
591775	 Stance classification determines the attitude, or stance, in a (typically short) text. The task has powerful applications, such as the detection of fake news or the automatic extraction of attitudes toward entities or events in the media. This paper describes a surprisingly simple and efficient classification approach to open stance classification in Twitter, for rumour and veracity classification. The approach profits from a novel set of automatically identifiable problem-specific features, which significantly boost classifier accuracy and achieve above state-of-the-art results on recent benchmark datasets. This calls into question the value of using complex sophisticated models for stance classification without first doing informed feature extraction. 	1708.05286	Ahmet Aker, Leon Derczynski, Kalina Bontcheva	2017-08-17		3	1	Simple Open Stance Classification for Rumour Analysis	2017-09-14	cs.CL	https://arxiv.org/pdf/1708.05286.pdf
631436	 Sentiment analysis on large-scale social media data is important to bridge the gaps between social media contents and real world activities including political election prediction, individual and public emotional status monitoring and analysis, and so on. Although textual sentiment analysis has been well studied based on platforms such as Twitter and Instagram, analysis of the role of extensive emoji uses in sentiment analysis remains light. In this paper, we propose a novel scheme for Twitter sentiment analysis with extra attention on emojis. We first learn bi-sense emoji embeddings under positive and negative sentimental tweets individually, and then train a sentiment classifier by attending on these bi-sense emoji embeddings with an attention-based long short-term memory network (LSTM). Our experiments show that the bi-sense embedding is effective for extracting sentiment-aware embeddings of emojis and outperforms the state-of-the-art models. We also visualize the attentions to show that the bi-sense emoji embedding provides better guidance on the attention mechanism to obtain a more robust understanding of the semantics and sentiments. 	1807.07961	Yuxiao Chen, Jianbo Yuan, Quanzeng You, Jiebo Luo	2018-07-20	10.1145/3240508.3240533	4	2	Twitter Sentiment Analysis via Bi-sense Emoji Embedding and Attention-based LSTM	2018-08-06	cs.CL, cs.MM	https://arxiv.org/pdf/1807.07961.pdf
708185	 Named Entity Recognition (NER) is an important subtask of information extraction that seeks to locate and recognise named entities. Despite recent achievements, we still face limitations with correctly detecting and classifying entities, prominently in short and noisy text, such as Twitter. An important negative aspect in most of NER approaches is the high dependency on hand-crafted features and domain-specific knowledge, necessary to achieve state-of-the-art results. Thus, devising models to deal with such linguistically complex contexts is still challenging. In this paper, we propose a novel multi-level architecture that does not rely on any specific linguistic resource or encoded rule. Unlike traditional approaches, we use features extracted from images and text to classify named entities. Experimental tests against state-of-the-art NER for Twitter on the Ritter dataset present competitive results (0.59 F-measure), indicating that this approach may lead towards better NER models. 	1710.11027	Diego Esteves, Rafael Peres, Jens Lehmann, Giulio Napolitano	2017-10-30		4	2	Named Entity Recognition in Twitter using Images and Text		cs.IR, cs.CL	https://arxiv.org/pdf/1710.11027.pdf
713575	 Twitter messages often contain so-called hashtags to denote keywords related to them. Using a dataset of 29 million messages, I explore relations among these hashtags with respect to co-occurrences. Furthermore, I present an attempt to classify hashtags into five intuitive classes, using a machine-learning approach. The overall outcome is an interactive Web application to explore Twitter hashtags. 	1111.6553	Jan Pöschko	2011-11-28		1	1	Exploring Twitter Hashtags		cs.CL	https://arxiv.org/pdf/1111.6553.pdf
782234	 With the development of the Internet, natural language processing (NLP), in which sentiment analysis is an important task, became vital in information processing.Sentiment analysis includes aspect sentiment classification. Aspect sentiment can provide complete and in-depth results with increased attention on aspect-level. Different context words in a sentence influence the sentiment polarity of a sentence variably, and polarity varies based on the different aspects in a sentence. Take the sentence, 'I bought a new camera. The picture quality is amazing but the battery life is too short.'as an example. If the aspect is picture quality, then the expected sentiment polarity is 'positive', if the battery life aspect is considered, then the sentiment polarity should be 'negative'; therefore, aspect is important to consider when we explore aspect sentiment in the sentence. Recurrent neural network (RNN) is regarded as a good model to deal with natural language processing, and RNNs has get good performance on aspect sentiment classification including Target-Dependent LSTM (TD-LSTM) ,Target-Connection LSTM (TC-LSTM) (Tang, 2015a, b), AE-LSTM, AT-LSTM, AEAT-LSTM (Wang et al., 2016).There are also extensive literatures on sentiment classification utilizing convolutional neural network, but there is little literature on aspect sentiment classification using convolutional neural network. In our paper, we develop attention-based input layers in which aspect information is considered by input layer. We then incorporate attention-based input layers into convolutional neural network (CNN) to introduce context words information. In our experiment, incorporating aspect information into CNN improves the latter's aspect sentiment classification performance without using syntactic parser or external sentiment lexicons in a benchmark dataset from Twitter but get better performance compared with other models. 	1807.01704	Yongping Xing, Chuangbai Xiao, Yifei Wu, Ziming Ding	2018-07-04		4	1	A Convolutional Neural Network for Aspect Sentiment Classification		cs.CL	https://arxiv.org/pdf/1807.01704.pdf
805698	 Toxic online content has become a major issue in today's world due to an exponential increase in the use of internet by people of different cultures and educational background. Differentiating hate speech and offensive language is a key challenge in automatic detection of toxic text content. In this paper, we propose an approach to automatically classify tweets on Twitter into three classes: hateful, offensive and clean. Using Twitter dataset, we perform experiments considering n-grams as features and passing their term frequency-inverse document frequency (TFIDF) values to multiple machine learning models. We perform comparative analysis of the models considering several values of n in n-grams and TFIDF normalization methods. After tuning the model giving the best results, we achieve 95.6% accuracy upon evaluating it on test data. We also create a module which serves as an intermediate between user and Twitter. 	1809.08651	Aditya Gaydhani, Vikrant Doma, Shrikant Kendre, Laxmi Bhagwat	2018-09-23		4	1	Detecting Hate Speech and Offensive Language on Twitter using Machine Learning: An N-gram and TFIDF based Approach		cs.CL	https://arxiv.org/pdf/1809.08651.pdf
821677	 In this paper, we present TwiSent, a sentiment analysis system for Twitter. Based on the topic searched, TwiSent collects tweets pertaining to it and categorizes them into the different polarity classes positive, negative and objective. However, analyzing micro-blog posts have many inherent challenges compared to the other text genres. Through TwiSent, we address the problems of 1) Spams pertaining to sentiment analysis in Twitter, 2) Structural anomalies in the text in the form of incorrect spellings, nonstandard abbreviations, slangs etc., 3) Entity specificity in the context of the topic searched and 4) Pragmatics embedded in text. The system performance is evaluated on manually annotated gold standard data and on an automatically annotated tweet set based on hashtags. It is a common practise to show the efficacy of a supervised system on an automatically annotated dataset. However, we show that such a system achieves lesser classification accurcy when tested on generic twitter dataset. We also show that our system performs much better than an existing system. 	1209.2495	Subhabrata Mukherjee, Akshat Malu, A. R. Balamurali, Pushpak Bhattacharyya	2012-09-12		4	2	TwiSent: A Multistage System for Analyzing Sentiment in Twitter	2012-09-18	cs.IR, cs.CL	https://arxiv.org/pdf/1209.2495.pdf
853609	 Target-dependent sentiment classification remains a challenge: modeling the semantic relatedness of a target with its context words in a sentence. Different context words have different influences on determining the sentiment polarity of a sentence towards the target. Therefore, it is desirable to integrate the connections between target word and context words when building a learning system. In this paper, we develop two target dependent long short-term memory (LSTM) models, where target information is automatically taken into account. We evaluate our methods on a benchmark dataset from Twitter. Empirical results show that modeling sentence representation with standard LSTM does not perform well. Incorporating target information into LSTM can significantly boost the classification accuracy. The target-dependent LSTM models achieve state-of-the-art performances without using syntactic parser or external sentiment lexicons. 	1512.01100	Duyu Tang, Bing Qin, Xiaocheng Feng, Ting Liu	2015-12-03		4	1	Effective LSTMs for Target-Dependent Sentiment Classification	2016-09-29	cs.CL	https://arxiv.org/pdf/1512.01100.pdf
856027	 Hate speech detection on Twitter is critical for applications like controversial event extraction, building AI chatterbots, content recommendation, and sentiment analysis. We define this task as being able to classify a tweet as racist, sexist or neither. The complexity of the natural language constructs makes this task very challenging. We perform extensive experiments with multiple deep learning architectures to learn semantic word embeddings to handle this complexity. Our experiments on a benchmark dataset of 16K annotated tweets show that such deep learning methods outperform state-of-the-art char/word n-gram methods by ~18 F1 points. 	1706.00188	Pinkesh Badjatiya, Shashank Gupta, Manish Gupta, Vasudeva Varma	2017-06-01	10.1145/3041021.3054223	4	2	Deep Learning for Hate Speech Detection in Tweets		cs.CL, cs.IR	https://arxiv.org/pdf/1706.00188.pdf
